{
  "schema": "kumwe-test-ownership/v1",
  "package": "kumwe/business-definition",
  "api_manifest": "resources/public-api/v1.json",
  "suite": {
    "inventory_command": [
      "php",
      "tests/run.php",
      "--list-json"
    ]
  },
  "exports": {
    "Kumwe\\BusinessDefinition\\Application\\BusinessDefinitionCompatibilityAnalyzer": {
      "behavior": [
        "Kumwe\\BusinessDefinition\\Tests\\Unit\\ConformanceTest::testDefinitionAndCompatibilityCorpusMatchesFrozenBaseline"
      ],
      "boundary": [
        "Kumwe\\BusinessDefinition\\Tests\\Unit\\ConformanceTest::testDefinitionAndCompatibilityCorpusMatchesFrozenBaseline"
      ]
    },
    "Kumwe\\BusinessDefinition\\Application\\BusinessDefinitionContributionRegistry": {
      "behavior": [
        "Kumwe\\BusinessDefinition\\Tests\\Unit\\AdmissionAndRegistryTest::testRegistriesKeepOwnerBoundariesAndExplicitRemoval"
      ],
      "boundary": [
        "Kumwe\\BusinessDefinition\\Tests\\Unit\\AdmissionAndRegistryTest::testRegistriesKeepOwnerBoundariesAndExplicitRemoval"
      ]
    },
    "Kumwe\\BusinessDefinition\\Application\\BusinessDefinitionValidator": {
      "behavior": [
        "Kumwe\\BusinessDefinition\\Tests\\Unit\\AdmissionAndRegistryTest::testAdmissionIsMandatoryInvokedAndFailClosed"
      ],
      "boundary": [
        "Kumwe\\BusinessDefinition\\Tests\\Unit\\AdmissionAndRegistryTest::testAdmissionIsMandatoryInvokedAndFailClosed"
      ]
    },
    "Kumwe\\BusinessDefinition\\Application\\DefinitionCatalogEntry": {
      "behavior": [
        "Kumwe\\BusinessDefinition\\Tests\\Unit\\AdmissionAndRegistryTest::testDefinitionRecordsPreserveSnapshotsAndRefuseInconsistentEvidence"
      ],
      "boundary": [
        "Kumwe\\BusinessDefinition\\Tests\\Unit\\AdmissionAndRegistryTest::testDefinitionRecordsPreserveSnapshotsAndRefuseInconsistentEvidence"
      ]
    },
    "Kumwe\\BusinessDefinition\\Application\\DefinitionDraft": {
      "behavior": [
        "Kumwe\\BusinessDefinition\\Tests\\Unit\\AdmissionAndRegistryTest::testDefinitionRecordsPreserveSnapshotsAndRefuseInconsistentEvidence"
      ],
      "boundary": [
        "Kumwe\\BusinessDefinition\\Tests\\Unit\\AdmissionAndRegistryTest::testDefinitionRecordsPreserveSnapshotsAndRefuseInconsistentEvidence"
      ]
    },
    "Kumwe\\BusinessDefinition\\Application\\DefinitionVersionRecord": {
      "behavior": [
        "Kumwe\\BusinessDefinition\\Tests\\Unit\\AdmissionAndRegistryTest::testDefinitionRecordsPreserveSnapshotsAndRefuseInconsistentEvidence"
      ],
      "boundary": [
        "Kumwe\\BusinessDefinition\\Tests\\Unit\\AdmissionAndRegistryTest::testDefinitionRecordsPreserveSnapshotsAndRefuseInconsistentEvidence"
      ]
    },
    "Kumwe\\BusinessDefinition\\Application\\FieldConfigurationAdmission": {
      "behavior": [
        "Kumwe\\BusinessDefinition\\Tests\\Unit\\AdmissionAndRegistryTest::testAdmissionIsMandatoryInvokedAndFailClosed"
      ],
      "boundary": [
        "Kumwe\\BusinessDefinition\\Tests\\Unit\\AdmissionAndRegistryTest::testAdmissionIsMandatoryInvokedAndFailClosed"
      ]
    },
    "Kumwe\\BusinessDefinition\\Application\\FieldTypeDefinitionResolver": {
      "behavior": [
        "Kumwe\\BusinessDefinition\\Tests\\Unit\\AdmissionAndRegistryTest::testRegistriesKeepOwnerBoundariesAndExplicitRemoval"
      ],
      "boundary": [
        "Kumwe\\BusinessDefinition\\Tests\\Unit\\AdmissionAndRegistryTest::testRegistriesKeepOwnerBoundariesAndExplicitRemoval"
      ]
    },
    "Kumwe\\BusinessDefinition\\Application\\FieldTypeRegistry": {
      "behavior": [
        "Kumwe\\BusinessDefinition\\Tests\\Unit\\AdmissionAndRegistryTest::testRegistriesKeepOwnerBoundariesAndExplicitRemoval"
      ],
      "boundary": [
        "Kumwe\\BusinessDefinition\\Tests\\Unit\\AdmissionAndRegistryTest::testRegistriesKeepOwnerBoundariesAndExplicitRemoval"
      ]
    },
    "Kumwe\\BusinessDefinition\\ConfigProvider": {
      "behavior": [
        "Kumwe\\BusinessDefinition\\Tests\\Unit\\AdmissionAndRegistryTest::testRealContainerHasExplicitPortsAndServiceLifetimes"
      ],
      "boundary": [
        "Kumwe\\BusinessDefinition\\Tests\\Unit\\AdmissionAndRegistryTest::testRealContainerHasExplicitPortsAndServiceLifetimes"
      ]
    },
    "Kumwe\\BusinessDefinition\\Container\\BusinessDefinitionContributionRegistryFactory": {
      "behavior": [
        "Kumwe\\BusinessDefinition\\Tests\\Unit\\AdmissionAndRegistryTest::testRealContainerHasExplicitPortsAndServiceLifetimes"
      ],
      "boundary": [
        "Kumwe\\BusinessDefinition\\Tests\\Unit\\AdmissionAndRegistryTest::testRealContainerHasExplicitPortsAndServiceLifetimes"
      ]
    },
    "Kumwe\\BusinessDefinition\\Container\\BusinessDefinitionValidatorFactory": {
      "behavior": [
        "Kumwe\\BusinessDefinition\\Tests\\Unit\\AdmissionAndRegistryTest::testRealContainerHasExplicitPortsAndServiceLifetimes"
      ],
      "boundary": [
        "Kumwe\\BusinessDefinition\\Tests\\Unit\\AdmissionAndRegistryTest::testRealContainerHasExplicitPortsAndServiceLifetimes"
      ]
    },
    "Kumwe\\BusinessDefinition\\Container\\FieldTypeRegistryFactory": {
      "behavior": [
        "Kumwe\\BusinessDefinition\\Tests\\Unit\\AdmissionAndRegistryTest::testRealContainerHasExplicitPortsAndServiceLifetimes"
      ],
      "boundary": [
        "Kumwe\\BusinessDefinition\\Tests\\Unit\\AdmissionAndRegistryTest::testRealContainerHasExplicitPortsAndServiceLifetimes"
      ]
    },
    "Kumwe\\BusinessDefinition\\Domain\\ActionDefinition": {
      "behavior": [
        "Kumwe\\BusinessDefinition\\Tests\\Unit\\Domain\\CustomBusinessDefinitionReferenceTest::testLegacyViewAndActionCanonicalBytesRemainUnchanged"
      ],
      "boundary": [
        "Kumwe\\BusinessDefinition\\Tests\\Unit\\Domain\\CustomBusinessDefinitionReferenceTest::testCustomReferencesArePairedBoundedAndMutuallyExclusiveWithTransitions"
      ]
    },
    "Kumwe\\BusinessDefinition\\Domain\\BuiltInFieldTypes": {
      "behavior": [
        "Kumwe\\BusinessDefinition\\Tests\\Unit\\AdmissionAndRegistryTest::testFieldTypeRoundTripsAndRefusesIncompatibleDeclarations"
      ],
      "boundary": [
        "Kumwe\\BusinessDefinition\\Tests\\Unit\\AdmissionAndRegistryTest::testFieldTypeRoundTripsAndRefusesIncompatibleDeclarations"
      ]
    },
    "Kumwe\\BusinessDefinition\\Domain\\CanonicalDefinitionJson": {
      "behavior": [
        "Kumwe\\BusinessDefinition\\Tests\\Unit\\ConformanceTest::testFormulaCorpusMatchesFrozenBaseline"
      ],
      "boundary": [
        "Kumwe\\BusinessDefinition\\Tests\\Unit\\ConformanceTest::testFormulaCorpusMatchesFrozenBaseline"
      ]
    },
    "Kumwe\\BusinessDefinition\\Domain\\CompatibilityChange": {
      "behavior": [
        "Kumwe\\BusinessDefinition\\Tests\\Unit\\ConformanceTest::testDefinitionAndCompatibilityCorpusMatchesFrozenBaseline"
      ],
      "boundary": [
        "Kumwe\\BusinessDefinition\\Tests\\Unit\\ConformanceTest::testDefinitionAndCompatibilityCorpusMatchesFrozenBaseline"
      ]
    },
    "Kumwe\\BusinessDefinition\\Domain\\CompatibilityClassification": {
      "behavior": [
        "Kumwe\\BusinessDefinition\\Tests\\Unit\\ConformanceTest::testDefinitionAndCompatibilityCorpusMatchesFrozenBaseline"
      ],
      "boundary": [
        "Kumwe\\BusinessDefinition\\Tests\\Unit\\ConformanceTest::testDefinitionAndCompatibilityCorpusMatchesFrozenBaseline"
      ]
    },
    "Kumwe\\BusinessDefinition\\Domain\\CompatibilityPlan": {
      "behavior": [
        "Kumwe\\BusinessDefinition\\Tests\\Unit\\ConformanceTest::testDefinitionAndCompatibilityCorpusMatchesFrozenBaseline"
      ],
      "boundary": [
        "Kumwe\\BusinessDefinition\\Tests\\Unit\\ConformanceTest::testDefinitionAndCompatibilityCorpusMatchesFrozenBaseline"
      ]
    },
    "Kumwe\\BusinessDefinition\\Domain\\ComputationMode": {
      "behavior": [
        "Kumwe\\BusinessDefinition\\Tests\\Unit\\Domain\\EntityTypeDefinitionTest::testStoredComputationIsExplicitAndVirtualRemainsCanonicalDefault"
      ],
      "boundary": [
        "Kumwe\\BusinessDefinition\\Tests\\Unit\\Domain\\EntityTypeDefinitionTest::testComputedFieldRequiresServerOnlyReadOnlyFormula"
      ]
    },
    "Kumwe\\BusinessDefinition\\Domain\\DefinitionOwner": {
      "behavior": [
        "Kumwe\\BusinessDefinition\\Tests\\Unit\\AdmissionAndRegistryTest::testDefinitionOwnershipPreservesPersistedGrammarAndRefusals"
      ],
      "boundary": [
        "Kumwe\\BusinessDefinition\\Tests\\Unit\\AdmissionAndRegistryTest::testDefinitionOwnershipPreservesPersistedGrammarAndRefusals"
      ]
    },
    "Kumwe\\BusinessDefinition\\Domain\\DefinitionOwnerType": {
      "behavior": [
        "Kumwe\\BusinessDefinition\\Tests\\Unit\\AdmissionAndRegistryTest::testDefinitionOwnershipPreservesPersistedGrammarAndRefusals"
      ],
      "boundary": [
        "Kumwe\\BusinessDefinition\\Tests\\Unit\\AdmissionAndRegistryTest::testDefinitionOwnershipPreservesPersistedGrammarAndRefusals"
      ]
    },
    "Kumwe\\BusinessDefinition\\Domain\\DefinitionStatus": {
      "behavior": [
        "Kumwe\\BusinessDefinition\\Tests\\Unit\\AdmissionAndRegistryTest::testDefinitionRecordsPreserveSnapshotsAndRefuseInconsistentEvidence"
      ],
      "boundary": [
        "Kumwe\\BusinessDefinition\\Tests\\Unit\\AdmissionAndRegistryTest::testDefinitionRecordsPreserveSnapshotsAndRefuseInconsistentEvidence"
      ]
    },
    "Kumwe\\BusinessDefinition\\Domain\\DeleteBehavior": {
      "behavior": [
        "Kumwe\\BusinessDefinition\\Tests\\Unit\\Application\\ReversalRelationshipValidationTest::testASameDefinitionReversalPairValidates"
      ],
      "boundary": [
        "Kumwe\\BusinessDefinition\\Tests\\Unit\\Application\\ReversalRelationshipValidationTest::testAReversalThatDoesNotRestrictDeletionIsRefused"
      ]
    },
    "Kumwe\\BusinessDefinition\\Domain\\DocumentViewDefinition": {
      "behavior": [